{
  "module": "subscriptions",
  "generated_from_fixture": true,
  "final_subscription_state": "retained",
  "source_of_truth_system": "stayai",
  "source_confirmation_status": "confirmed",
  "subscription_overview": {
    "subscription_overview_count": 120,
    "cancellation_requests_count": 34,
    "confirmed_cancellations_count": 11,
    "save_retention_attempts_count": 23,
    "confirmed_retained_subscriptions_count": 18,
    "pending_stayai_confirmation_count": 5
  },
  "portal_journey": {
    "portal_link_sent_count": 16,
    "confirmed_portal_completion_count": 10
  },
  "shopify_context": {
    "context_records_available_count": 116,
    "context_role": "context_only",
    "finalization_allowed": false
  },
  "synthflow_journey": {
    "journey_event_count": 148,
    "status_breakdown": {
      "completed": 92,
      "unresolved": 18,
      "transferred": 21,
      "abandoned": 17
    }
  },
  "source_confirmation": {
    "source_of_truth_system": "stayai",
    "source_confirmation_status": "confirmed",
    "confirmed_records_count": 115,
    "pending_records_count": 5,
    "missing_records_count": 0
  },
  "metric_metadata": {
    "metric_id": "subscription_analytics_overview",
    "metric_definitions": [
      "subscription_action_completion_rate",
      "confirmed_cancellation_rate",
      "subscription_save_rate",
      "portal_completion_rate"
    ],
    "filters": {
      "date_range": "last_7_days",
      "platforms": ["stayai", "synthflow", "shopify"]
    },
    "formula_version": "v0.4.0",
    "freshness": "fresh",
    "trust_label": "medium",
    "owner": "analytics",
    "timestamp": "2026-05-01T00:00:00Z",
    "fingerprint": "3393587d3d7fd964fc8b95fa08817f79420c749836fdeef53cb1bc8258b0bcc4",
    "audit_reference": "audit-subscriptions-baseline-20260501",
    "source_system": "analytics_api",
    "source_confirmation_status": "confirmed",
    "presentation": {
      "display_label": "Subscription Analytics Overview",
      "short_label": "Overview",
      "executive_summary": "Preview baseline summarizing subscription outcomes with Stay.ai confirmation as source truth guardrail.",
      "format_type": "count_and_rate_bundle",
      "unit": "mixed",
      "trend_direction": "unknown",
      "comparison_label": "Comparison baseline unavailable in fixture preview",
      "comparison_value": null,
      "severity": "warning",
      "visual_tone": "caution",
      "source_authority_explanation": "Stay.ai is the source of truth for final subscription state and outcome confirmation.",
      "trust_explanation": "Trust is medium because unresolved or unknown outcomes still require caution even with confirmed primary source records.",
      "freshness_explanation": "Data freshness is within the expected update window.",
      "drilldown_hint": "Use subscription outcomes and source health views for confirmation and lineage detail.",
      "empty_state_copy": "No eligible records were available for this calculation window.",
      "blocked_state_copy": "This metric is blocked until Stay.ai confirmation records are available."
    }
  }
}
